{
  "artifact_sha256": "3333333333333333333333333333333333333333333333333333333333333333",
  "build_commit": "0000000000000000000000000000000000000000",
  "config_bundle_sha256": "2222222222222222222222222222222222222222222222222222222222222222",
  "contract_manifest_sha256": "1111111111111111111111111111111111111111111111111111111111111111",
  "emitted_at_us": 1786156800123456,
  "event_id": "evt_triad_market_event_v2",
  "event_kind": "DEPTH_DIFF",
  "payload": {
    "canonical_instrument_id": "x",
    "connection_epoch": "1",
    "instrument_metadata_revision": "1",
    "local_receipt_mono_ns": "0",
    "local_receipt_wall_us": 1786156800123456,
    "normalization_time_us": 1786156800123456,
    "parser_version": "x",
    "quality": {},
    "raw_event_id": "x",
    "raw_payload_hash": "0000000000000000000000000000000000000000000000000000000000000000",
    "receive_sequence": "1",
    "route_family": "PUBLIC",
    "source_event_time_us": 1786156800123456,
    "source_stream": "x",
    "venue": "x",
    "venue_instrument_id": "x"
  },
  "producer_epoch": "42",
  "producer_instance_id": "inst_golden_01",
  "producer_service": "triad-e00",
  "schema": "triad.market_event.v2",
  "schema_version": "2.0.0"
}
